{
  "id": "osmf:trial:nct-00540254",
  "type": "trial",
  "label": "Behavioral Insomnia Therapy With Chronic Fatigue Syndrome",
  "aliases": [],
  "summary": "Status: COMPLETED. Phase: PHASE1. Conditions: ME/CFS; Chronic Fatigue Syndrome; Behavioral Therapy Targeted to Sleep Problems. Enrollment listed: 24. Registration metadata only; not an efficacy assessment.",
  "external_ids": [
    {
      "system": "nct",
      "value": "NCT00540254",
      "url": "https://clinicaltrials.gov/study/NCT00540254"
    }
  ],
  "urls": [
    {
      "rel": "other",
      "href": "https://clinicaltrials.gov/study/NCT00540254"
    }
  ],
  "status": "active",
  "updated_at": "2026-09-19T17:50:46.160Z"
}
