{
  "id": "osmf:agent:compensatory-cognitive-training-for-covid-19",
  "type": "agent",
  "label": "Compensatory Cognitive Training For Covid-19",
  "aliases": [],
  "summary": "Enrollment: Estimated, Neurological / Autonomic, Sponsor Type: Fed Investigational for listed conditions. 1 associated trial(s) and 0 study reference(s) in current data. Review primary sources and consult specialists before use. See tracker agent page / linked studies; Desk does not provide dosing.",
  "external_ids": [
    {
      "system": "other",
      "value": "https://pubchem.ncbi.nlm.nih.gov/#query=Compensatory%20Cognitive%20Training%20For%20Covid-19",
      "url": "https://pubchem.ncbi.nlm.nih.gov/#query=Compensatory%20Cognitive%20Training%20For%20Covid-19"
    }
  ],
  "urls": [
    {
      "rel": "tracker",
      "href": "https://research.opensourcemed.info/agents/compensatory-cognitive-training-for-covid-19/"
    }
  ],
  "status": "active",
  "updated_at": "2026-09-19T17:04:30.227Z"
}
