{
  "id": "osmf:agent:physical-training-program",
  "type": "agent",
  "label": "Physical Training Program",
  "aliases": [],
  "summary": "Enrollment: Estimated, Sponsor Type: Network, Unknown / General Investigational for listed conditions. 1 associated trial(s) and 0 study reference(s) in current data. Review primary sources and consult specialists before use. See tracker agent page / linked studies; Desk does not provide dosing.",
  "external_ids": [
    {
      "system": "other",
      "value": "https://pubchem.ncbi.nlm.nih.gov/#query=Physical%20Training%20Program",
      "url": "https://pubchem.ncbi.nlm.nih.gov/#query=Physical%20Training%20Program"
    }
  ],
  "urls": [
    {
      "rel": "tracker",
      "href": "https://research.opensourcemed.info/agents/physical-training-program/"
    }
  ],
  "status": "active",
  "updated_at": "2026-09-19T17:04:30.227Z"
}
