{
  "id": "osmf:agent:patient-partner-videotelephone-delivered-health-information",
  "type": "agent",
  "label": "Patient-Partner Videotelephone-Delivered Health Information",
  "aliases": [],
  "summary": "Enrollment: Actual, Immunomodulatory, Sponsor Type: Other Investigational for listed conditions. 1 associated trial(s) and 0 study reference(s) in current data. Review primary sources and consult specialists before use. See tracker agent page / linked studies; Desk does not provide dosing.",
  "external_ids": [
    {
      "system": "other",
      "value": "https://pubchem.ncbi.nlm.nih.gov/#query=Patient-Partner%20Videotelephone-Delivered%20Health%20Information",
      "url": "https://pubchem.ncbi.nlm.nih.gov/#query=Patient-Partner%20Videotelephone-Delivered%20Health%20Information"
    }
  ],
  "urls": [
    {
      "rel": "tracker",
      "href": "https://research.opensourcemed.info/agents/patient-partner-videotelephone-delivered-health-information/"
    }
  ],
  "status": "active",
  "updated_at": "2026-09-19T17:04:30.227Z"
}
