{
  "id": "osmf:agent:sildenafil",
  "type": "agent",
  "label": "Sildenafil",
  "aliases": [],
  "summary": "Enrollment: Actual, Sponsor Type: Other, Unknown / General Investigational for listed conditions. 1 associated trial(s) and 0 study reference(s) in current data. Review primary sources and consult specialists before use. See tracker agent page / linked studies; Desk does not provide dosing.",
  "external_ids": [
    {
      "system": "other",
      "value": "https://pubchem.ncbi.nlm.nih.gov/#query=Sildenafil",
      "url": "https://pubchem.ncbi.nlm.nih.gov/#query=Sildenafil"
    }
  ],
  "urls": [
    {
      "rel": "tracker",
      "href": "https://research.opensourcemed.info/agents/sildenafil/"
    }
  ],
  "status": "active",
  "updated_at": "2026-09-19T17:04:30.227Z"
}
