{
  "id": "osmf:trial:nct-02108210",
  "type": "trial",
  "label": "Cytokine Inhibition in Chronic Fatigue Syndrome Patients",
  "aliases": [],
  "summary": "Status: COMPLETED. Phase: PHASE2. Conditions: ME/CFS; Chronic Fatigue Syndrome. Enrollment listed: 50. Registration metadata only; not an efficacy assessment.",
  "external_ids": [
    {
      "system": "nct",
      "value": "NCT02108210",
      "url": "https://clinicaltrials.gov/study/NCT02108210"
    }
  ],
  "urls": [
    {
      "rel": "other",
      "href": "https://clinicaltrials.gov/study/NCT02108210"
    }
  ],
  "status": "active",
  "updated_at": "2026-09-19T17:50:46.160Z"
}
