{
  "id": "osmf:agent:naltrexone",
  "type": "agent",
  "label": "Naltrexone",
  "aliases": [],
  "summary": "Enrollment: Actual, Immunomodulatory, Repurposed Drug, Sponsor Type: Industry Investigational for listed conditions. 1 associated trial(s) and 1 study reference(s) in current data. Review primary sources and consult specialists before use. See tracker agent page / linked studies; Desk does not provide dosing.",
  "external_ids": [
    {
      "system": "other",
      "value": "https://pubchem.ncbi.nlm.nih.gov/#query=Naltrexone",
      "url": "https://pubchem.ncbi.nlm.nih.gov/#query=Naltrexone"
    }
  ],
  "urls": [
    {
      "rel": "tracker",
      "href": "https://research.opensourcemed.info/agents/naltrexone/"
    }
  ],
  "status": "active",
  "updated_at": "2026-09-19T17:04:30.227Z"
}
