{
  "id": "osmf:paper:pmid-41598987",
  "type": "paper",
  "label": "Autonomic Dysfunction in Patients with Acute Infection with",
  "aliases": [],
  "summary": "No abstract available.",
  "external_ids": [
    {
      "system": "pubmed",
      "value": "41598987",
      "url": "https://pubmed.ncbi.nlm.nih.gov/41598987/"
    }
  ],
  "urls": [
    {
      "rel": "other",
      "href": "https://pubmed.ncbi.nlm.nih.gov/41598987/"
    }
  ],
  "status": "active",
  "updated_at": "2026-09-19T16:57:32.049Z"
}
