{
  "id": "osmf:agent:aspirin",
  "type": "agent",
  "label": "Aspirin",
  "aliases": [],
  "summary": "Not specified Investigational for listed conditions. 0 associated trial(s) and 1 study reference(s) in current data. Review primary sources and consult specialists before use. See tracker agent page / linked studies; Desk does not provide dosing.",
  "external_ids": [
    {
      "system": "other",
      "value": "https://pubchem.ncbi.nlm.nih.gov/#query=Aspirin",
      "url": "https://pubchem.ncbi.nlm.nih.gov/#query=Aspirin"
    }
  ],
  "urls": [
    {
      "rel": "tracker",
      "href": "https://research.opensourcemed.info/agents/aspirin/"
    }
  ],
  "status": "active",
  "updated_at": "2026-09-19T17:04:30.227Z"
}
